{
  "$schema": "https://json-schema.org/draft/2020-12/schema",
  "$id": "https://spec.rembrane.dev/memory-provider/mixed-version-evidence.schema.json",
  "title": "Rembrane Memory Provider Mixed-Version Evidence",
  "type": "object",
  "additionalProperties": false,
  "required": [
    "schemaVersion",
    "generatedAt",
    "harnessSourceRevision",
    "profileSha256",
    "fixtureSha256",
    "oldestSupportedMinor",
    "newestSupportedMinor",
    "runs"
  ],
  "properties": {
    "schemaVersion": {
      "const": 1
    },
    "generatedAt": {
      "type": "string",
      "format": "date-time",
      "pattern": "^\\d{4}-\\d{2}-\\d{2}T\\d{2}:\\d{2}:\\d{2}Z$"
    },
    "harnessSourceRevision": {
      "type": "string",
      "pattern": "^[0-9a-f]{40}$"
    },
    "profileSha256": {
      "type": "string",
      "pattern": "^[0-9a-f]{64}$"
    },
    "fixtureSha256": {
      "type": "string",
      "pattern": "^[0-9a-f]{64}$"
    },
    "oldestSupportedMinor": {
      "$ref": "#/$defs/protocolVersion"
    },
    "newestSupportedMinor": {
      "$ref": "#/$defs/protocolVersion"
    },
    "runs": {
      "type": "array",
      "minItems": 3,
      "maxItems": 3,
      "items": {
        "type": "object",
        "additionalProperties": false,
        "required": [
          "scenario",
          "client",
          "provider",
          "namespace",
          "result"
        ],
        "properties": {
          "scenario": {
            "enum": [
              "oldest-client-newest-provider",
              "newest-client-oldest-provider",
              "unsupported-major"
            ]
          },
          "client": {
            "$ref": "#/$defs/implementation"
          },
          "provider": {
            "$ref": "#/$defs/implementation"
          },
          "namespace": {
            "type": "string",
            "pattern": "^[A-Za-z0-9._-]{1,64}$"
          },
          "result": {
            "enum": [
              "pass",
              "rejected"
            ]
          }
        }
      }
    }
  },
  "$defs": {
    "protocolVersion": {
      "type": "string",
      "pattern": "^[0-9]+\\.[0-9]+$",
      "maxLength": 21
    },
    "implementation": {
      "type": "object",
      "additionalProperties": false,
      "required": [
        "id",
        "buildVersion",
        "sourceRevision",
        "protocolVersion"
      ],
      "properties": {
        "id": {
          "type": "string",
          "pattern": "^[a-z0-9][a-z0-9._-]+$",
          "maxLength": 255
        },
        "buildVersion": {
          "type": "string",
          "minLength": 1,
          "maxLength": 100
        },
        "sourceRevision": {
          "type": "string",
          "pattern": "^[0-9a-f]{40}$"
        },
        "protocolVersion": {
          "$ref": "#/$defs/protocolVersion"
        }
      }
    }
  }
}
